name,doi,Abstract,keywords,URL,key,Algorithm used,Accuracy,base network/provided network,github,application,Dataset,Notes,favourite,Category
"S. Rajaraman, J. Siegelman, P. O. Alderson, L. S. Folio, L. R. Folio and S. K. Antani, ""Iteratively Pruned Deep Learning Ensembles for COVID-19 Detection in Chest X-Rays,"" in IEEE Access, vol. 8, pp. 115041-115050, 2020.",doi: 10.1109/ACCESS.2020.3003810,"Abstract: We demonstrate use of iteratively pruned deep learning model ensembles for detecting pulmonary manifestations of COVID-19 with chest X-rays. This disease is caused by the novel Severe Acute Respiratory Syndrome Coronavirus 2 (SARS-CoV-2) virus, also known as the novel Coronavirus (2019-nCoV). A custom convolutional neural network and a selection of ImageNet pretrained models are trained and evaluated at patient-level on publicly available CXR collections to learn modality-specific feature representations. The learned knowledge is transferred and fine-tuned to improve performance and generalization in the related task of classifying CXRs as normal, showing bacterial pneumonia, or COVID-19-viral abnormalities. The best performing models are iteratively pruned to reduce complexity and improve memory efficiency. The predictions of the best-performing pruned models are combined through different ensemble strategies to improve classification performance. Empirical evaluations demonstrate that the weighted average of the best-performing pruned models significantly improves performance resulting in an accuracy of 99.01% and area under the curve of 0.9972 in detecting COVID-19 findings on CXRs. The combined use of modality-specific knowledge transfer, iterative model pruning, and ensemble learning resulted in improved predictions. We expect that this model can be quickly adopted for COVID-19 screening using chest radiographs.","keywords: {convolutional neural nets;diagnostic radiography;diseases;image classification;learning (artificial intelligence);medical image processing;bacterial pneumonia;CXR collections;Severe Acute Respiratory Syndrome Coronavirus 2 virus;chest radiographs;COVID-19 screening;iterative model pruning;modality-specific knowledge transfer;COVID-19-viral abnormalities;modality-specific feature representations;convolutional neural network;SARS-CoV-2;pulmonary manifestations;iteratively pruned deep learning model ensembles;chest X-rays;COVID-19 detection;Lung;COVID-19;Microorganisms;Computational modeling;National Institutes of Health;Predictive models;COVID-19;convolutional neural network;deep learning;ensemble;iterative pruning},",URL: http://ieeexplore.ieee.org/stamp/stamp.jsp?tp=&arnumber=9121222&isnumber=8948470,115,R-CNN,0.99,CNN,,Covid-19 detection,"PEDIATRIC CXR, RSNA CXR, TWITTER COVID-19 CXR, MONTREAL COVID-19 CXR",,,
"A. Mobiny, H. Lu, H. V. Nguyen, B. Roysam and N. Varadarajan, ""Automated Classification of Apoptosis in Phase Contrast Microscopy Using Capsule Network,"" in IEEE Transactions on Medical Imaging, vol. 39, no. 1, pp. 1-10, Jan. 2020.",doi: 10.1109/TMI.2019.2918181,"Abstract: Automatic and accurate classification of apoptosis, or programmed cell death, will facilitate cell biology research. The state-of-the-art approaches in apoptosis classification use deep convolutional neural networks (CNNs). However, these networks are not efficient in encoding the part-whole relationships, thus requiring a large number of training samples to achieve robust generalization. This paper proposes an efficient variant of capsule networks (CapsNets) as an alternative to CNNs. Extensive experimental results demonstrate that the proposed CapsNets achieve competitive performances in target cell apoptosis classification, while significantly outperforming CNNs when the number of training samples is small. To utilize temporal information within microscopy videos, we propose a recurrent CapsNet constructed by stacking a CapsNet and a bi-directional long short-term recurrent structure. Our experiments show that when considering temporal constraints, the recurrent CapsNet achieves 93.8% accuracy and makes significantly more consistent prediction than NNs.","keywords: {biomedical optical imaging;cellular biophysics;image classification;learning (artificial intelligence);medical image processing;neural nets;training samples;microscopy videos;recurrent CapsNet;short-term recurrent structure;phase contrast microscopy;capsule network;cell death;cell biology research;deep convolutional neural networks;CNNs;part-whole relationships;robust generalization;efficient variant;target cell apoptosis classification;Routing;Task analysis;Training;Microscopy;Face;Feature extraction;Pediatrics;Apoptosis;capsule network;cell classification;Apoptosis;Cell Line, Tumor;Cells;Cytological Techniques;Humans;Image Processing, Computer-Assisted;Microscopy, Phase-Contrast;Neural Networks, Computer},",URL: http://ieeexplore.ieee.org/stamp/stamp.jsp?tp=&arnumber=8720196&isnumber=8946770,116,CapsE,88.2 F1,Capse net,,,"FashionMNIST, CIFAR-10",,,
"Q. Zhu, B. Du and P. Yan, ""Boundary-Weighted Domain Adaptive Neural Network for Prostate MR Image Segmentation,"" in IEEE Transactions on Medical Imaging, vol. 39, no. 3, pp. 753-763, March 2020.",doi: 10.1109/TMI.2019.2935018,"Abstract: Accurate segmentation of the prostate from magnetic resonance (MR) images provides useful information for prostate cancer diagnosis and treatment. However, automated prostate segmentation from 3D MR images faces several challenges. The lack of clear edge between the prostate and other anatomical structures makes it challenging to accurately extract the boundaries. The complex background texture and large variation in size, shape and intensity distribution of the prostate itself make segmentation even further complicated. Recently, as deep learning, especially convolutional neural networks (CNNs), emerging as the best performed methods for medical image segmentation, the difficulty in obtaining large number of annotated medical images for training CNNs has become much more pronounced than ever. Since large-scale dataset is one of the critical components for the success of deep learning, lack of sufficient training data makes it difficult to fully train complex CNNs. To tackle the above challenges, in this paper, we propose a boundary-weighted domain adaptive neural network (BOWDA-Net). To make the network more sensitive to the boundaries during segmentation, a boundary-weighted segmentation loss is proposed. Furthermore, an advanced boundary-weighted transfer leaning approach is introduced to address the problem of small medical imaging datasets. We evaluate our proposed model on three different MR prostate datasets. The experimental results demonstrate that the proposed model is more sensitive to object boundaries and outperformed other state-of-the-art methods.","keywords: {biological organs;biomedical MRI;cancer;convolutional neural nets;feature extraction;image segmentation;learning (artificial intelligence);medical image processing;annotated medical images;training CNN;deep learning;boundary-weighted domain adaptive neural network;boundary-weighted segmentation loss;medical imaging datasets;magnetic resonance images;prostate cancer diagnosis;automated prostate segmentation;intensity distribution;convolutional neural networks;medical image segmentation;prostate MR image segmentation;prostate cancer treatment;3D MR images;complex background texture;advanced boundary-weighted transfer leaning approach;Image segmentation;Biomedical imaging;Feature extraction;Neural networks;Shape;Training data;Adaptive systems;Image segmentation;prostate MR image;domain adaptation;convolutional neural network;boundary-weighted loss},",URL: http://ieeexplore.ieee.org/stamp/stamp.jsp?tp=&arnumber=8795525&isnumber=9023440,117,R-CNN,0.95,BOWDANet,https://github.com/ahukui/BOWDANet,MR Image Segmentation,PROMISE12 CHALLENGE,,,1
"Y. Zhang, P. David, H. Foroosh and B. Gong, ""A Curriculum Domain Adaptation Approach to the Semantic Segmentation of Urban Scenes,"" in IEEE Transactions on Pattern Analysis and Machine Intelligence, vol. 42, no. 8, pp. 1823-1841, 1 Aug. 2020.",doi: 10.1109/TPAMI.2019.2903401,"Abstract: During the last half decade, convolutional neural networks (CNNs) have triumphed over semantic segmentation, which is one of the core tasks in many applications such as autonomous driving and augmented reality. However, to train CNNs requires a considerable amount of data, which is difficult to collect and laborious to annotate. Recent advances in computer graphics make it possible to train CNNs on photo-realistic synthetic imagery with computer-generated annotations. Despite this, the domain mismatch between real images and the synthetic data hinders the models' performance. Hence, we propose a curriculum-style learning approach to minimizing the domain gap in urban scene semantic segmentation. The curriculum domain adaptation solves easy tasks first to infer necessary properties about the target domain; in particular, the first task is to learn global label distributions over images and local distributions over landmark superpixels. These are easy to estimate because images of urban scenes have strong idiosyncrasies (e.g., the size and spatial relations of buildings, streets, cars, etc.). We then train a segmentation network, while regularizing its predictions in the target domain to follow those inferred properties. In experiments, our method outperforms the baselines on two datasets and three backbone networks. We also report extensive ablation studies about our approach.","keywords: {augmented reality;computer graphics;convolutional neural nets;geographic information systems;image segmentation;learning (artificial intelligence);curriculum domain adaptation approach;urban scenes;convolutional neural networks;CNN;core tasks;autonomous driving;computer graphics;photo-realistic synthetic imagery;computer-generated annotations;domain mismatch;synthetic data;curriculum-style learning approach;domain gap;urban scene semantic segmentation;target domain;global label distributions;local distributions;segmentation network;inferred properties;backbone networks;Semantics;Image segmentation;Task analysis;Adaptation models;Neural networks;Training;Buildings;Domain adaptation;semantic segmentation;curriculum learning;curriculum domain adaptation;deep learning;self-driving},",URL: http://ieeexplore.ieee.org/stamp/stamp.jsp?tp=&arnumber=8661514&isnumber=9130977,118,R-CNN,,,,Semantic Segmentation,"VOC2012, COCO, GTA dataset",,,
"F. van Wyk, Y. Wang, A. Khojandi and N. Masoud, ""Real-Time Sensor Anomaly Detection and Identification in Automated Vehicles,"" in IEEE Transactions on Intelligent Transportation Systems, vol. 21, no. 3, pp. 1264-1276, March 2020.",doi: 10.1109/TITS.2019.2906038,"Abstract: Connected and automated vehicles (CAVs) are expected to revolutionize the transportation industry, mainly through allowing for a real-time and seamless exchange of information between vehicles and roadside infrastructure. Although connectivity and automation are projected to bring about a vast number of benefits, they can give rise to new challenges in terms of safety, security, and privacy. To navigate roadways, CAVs need to heavily rely on their sensor readings and the information received from other vehicles and roadside units. Hence, anomalous sensor readings caused by either malicious cyber attacks or faulty vehicle sensors can result in disruptive consequences and possibly lead to fatal crashes. As a result, before the mass implementation of CAVs, it is important to develop methodologies that can detect anomalies and identify their sources seamlessly and in real time. In this paper, we develop an anomaly detection approach through combining a deep learning method, namely convolutional neural network (CNN), with a well-established anomaly detection method, and Kalman filtering with a χ2-detector, to detect and identify anomalous behavior in CAVs. Our numerical experiments demonstrate that the developed approach can detect anomalies and identify their sources with high accuracy, sensitivity, and F1 score. In addition, this developed approach outperforms the anomaly detection and identification capabilities of both CNNs and Kalman filtering with a χ2-detector method alone. It is envisioned that this research will contribute to the development of safer and more resilient CAV systems that implement a holistic view toward intelligent transportation system (ITS) concepts.","keywords: {convolutional neural nets;fault diagnosis;Kalman filters;learning (artificial intelligence);sensor fusion;traffic engineering computing;convolutional neural network;sensor anomaly identification;Kalman filtering;deep learning method;roadside units;roadside infrastructure;connected and automated vehicles;sensor anomaly detection;CAV systems;Anomaly detection;Cyberattack;Real-time systems;Robot sensing systems;Kalman filters;Deep learning;Safety;Cyber-physical systems;fault diagnosis;intelligent vehicles;intrusion detection;vehicle safety},",URL: http://ieeexplore.ieee.org/stamp/stamp.jsp?tp=&arnumber=8684317&isnumber=9018398,119,CNN-KF,92 F1,CNN-KF,,,,,,
"L. Deng et al., ""Tianjic: A Unified and Scalable Chip Bridging Spike-Based and Continuous Neural Computation,"" in IEEE Journal of Solid-State Circuits, vol. 55, no. 8, pp. 2228-2246, Aug. 2020.",doi: 10.1109/JSSC.2020.2970709,"Abstract: Toward the long-standing dream of artificial intelligence, two successful solution paths have been paved: 1) neuromorphic computing and 2) deep learning. Recently, they tend to interact for simultaneously achieving biological plausibility and powerful accuracy. However, models from these two domains have to run on distinct substrates, i.e., neuromorphic platforms and deep learning accelerators, respectively. This architectural incompatibility greatly compromises the modeling flexibility and hinders promising interdisciplinary research. To address this issue, we build a unified model description framework and a unified processing architecture (Tianjic), which covers the full stack from software to hardware. By implementing a set of integration and transformation operations, Tianjic is able to support spiking neural networks, biological dynamic neural networks, multilayered perceptron, convolutional neural networks, recurrent neural networks, and so on. A compatible routing infrastructure enables homogeneous and heterogeneous scalability on a decentralized many-core network. Several optimization methods are incorporated, such as resource and data sharing, near-memory processing, compute/access skipping, and intra-/inter-core pipeline, to improve performance and efficiency. We further design streaming mapping schemes for efficient network deployment with a flexible tradeoff between execution throughput and resource overhead. A 28-nm prototype chip is fabricated with >610-GB/s internal memory bandwidth. A variety of benchmarks are evaluated and compared with GPUs and several existing specialized platforms. In summary, the fully unfolded mapping can achieve significantly higher throughput and power efficiency; the semi-folded mapping can save 30x resources while still presenting comparable performance on average. Finally, two hybrid-paradigm examples, a multimodal unmanned bicycle and a hybrid neural network, are demonstrated to show the potential of our unified architecture. This article paves a new way to explore neural computing.","keywords: {bicycles;convolutional neural nets;learning (artificial intelligence);multilayer perceptrons;pipeline processing;recurrent neural nets;Tianjic;continuous neural computation;artificial intelligence;biological plausibility;powerful accuracy;neuromorphic platforms;deep learning accelerators;architectural incompatibility;unified model description framework;unified processing architecture;transformation operations;biological dynamic neural networks;multilayered perceptron;convolutional neural networks;recurrent neural networks;compatible routing infrastructure;heterogeneous scalability;many-core network;optimization methods;data sharing;near-memory processing;network deployment;flexible tradeoff;execution throughput;internal memory bandwidth;fully unfolded mapping;power efficiency;semifolded mapping;hybrid neural network;unified chip bridging spike-based neural computation;scalable chip bridging spike-based neural computation;streaming mapping schemes;inter-core pipeline;intra-core pipeline;multimodal unmanned bicycle;Machine learning;Neuromorphics;Biological neural networks;Computational modeling;Computer architecture;Deep learning accelerator;hybrid paradigm;neuromorphic chip;unified/scalable architecture},",URL: http://ieeexplore.ieee.org/stamp/stamp.jsp?tp=&arnumber=8998338&isnumber=9146394,120,,,Tianjic,,,,,1,
"J. Chang, K. Kang and S. Kang, ""An Energy-Efficient FPGA-Based Deconvolutional Neural Networks Accelerator for Single Image Super-Resolution,"" in IEEE Transactions on Circuits and Systems for Video Technology, vol. 30, no. 1, pp. 281-295, Jan. 2020.",doi: 10.1109/TCSVT.2018.2888898,"Abstract: Convolutional neural networks (CNNs) demonstrate excellent performance in various computer vision applications. In recent years, FPGA-based CNN accelerators have been proposed for optimizing performance and power efficiency. Most accelerators are designed for object detection and recognition algorithms that are performed on low-resolution images. However, real-time image super-resolution (SR) cannot be implemented on a typical accelerator because of the long execution cycles required to generate high-resolution (HR) images, such as those used in ultra-high-definition systems. In this paper, we propose a novel CNN accelerator with efficient parallelization methods for SR applications. First, we propose a new methodology for optimizing the deconvolutional neural networks (DCNNs) used for increasing feature maps. Second, we propose a novel method to optimize CNN dataflow so that the SR algorithm can be driven at low power in display applications. Finally, we quantize and compress a DCNN-based SR algorithm into an optimal model for efficient inference using on-chip memory. We present an energy-efficient architecture for SR and validate our architecture on a mobile panel with quad-high-definition resolution. Our experimental results show that, with the same hardware resources, the proposed DCNN accelerator achieves a throughput up to 108 times greater than that of a conventional DCNN accelerator. In addition, our SR system achieves an energy efficiency of 144.9, 293.0, and 500.2 GOPS/W at SR scale factors of 2, 3, and 4, respectively. Furthermore, we demonstrate that our system can restore HR images to a high quality while greatly reducing the data bit-width and the number of parameters compared with conventional SR algorithms.","keywords: {computer vision;convolutional neural nets;field programmable gate arrays;image resolution;object detection;conventional SR algorithms;energy-efficient FPGA-based deconvolutional neural networks;single image super-resolution;convolutional neural networks;computer vision applications;FPGA-based CNN accelerators;optimizing performance;power efficiency;object detection;recognition algorithms;low-resolution images;real-time image super-resolution;typical accelerator;long execution cycles;high-resolution images;ultra-high-definition systems;novel CNN accelerator;parallelization methods;SR applications;CNN dataflow;display applications;DCNN-based SR algorithm;optimal model;energy-efficient architecture;quad-high-definition resolution;conventional DCNN accelerator;SR system;energy efficiency;SR scale factors;HR images;System-on-chip;Neural networks;Hardware;Memory management;Object detection;Inference algorithms;Accelerator architectures;deep neural networks (DNNs);deep learning;super-resolution;system architecture},",URL: http://ieeexplore.ieee.org/stamp/stamp.jsp?tp=&arnumber=8584497&isnumber=8951039,121,,,,,,,FPGA,,
"Y. Zhang, Y. Huang, S. Yu and L. Wang, ""Cross-View Gait Recognition by Discriminative Feature Learning,"" in IEEE Transactions on Image Processing, vol. 29, pp. 1001-1015, 2020.",doi: 10.1109/TIP.2019.2926208,"Abstract: Recently, deep learning-based cross-view gait recognition has become popular owing to the strong capacity of convolutional neural networks (CNNs). Current deep learning methods often rely on loss functions used widely in the task of face recognition, e.g., contrastive loss and triplet loss. These loss functions have the problem of hard negative mining. In this paper, a robust, effective, and gait-related loss function, called angle center loss (ACL), is proposed to learn discriminative gait features. The proposed loss function is robust to different local parts and temporal window sizes. Different from center loss which learns a center for each identity, the proposed loss function learns multiple sub-centers for each angle of the same identity. Only the largest distance between the anchor feature and the corresponding cross-view sub-centers is penalized, which achieves better intra-subject compactness. We also propose to extract discriminative spatial-temporal features by local feature extractors and a temporal attention model. A simplified spatial transformer network is proposed to localize the suitable horizontal parts of the human body. Local gait features for each horizontal part are extracted and then concatenated as the descriptor. We introduce long short-term memory (LSTM) units as the temporal attention model to learn the attention score for each frame, e.g., focusing more on discriminative frames and less on frames with bad quality. The temporal attention model shows better performance than the temporal average pooling or gait energy images (GEI). By combing the three aspects, we achieve state-of-the-art results on several cross-view gait recognition benchmarks.","keywords: {convolutional neural nets;face recognition;feature extraction;gait analysis;learning (artificial intelligence);recurrent neural nets;local feature extractors;temporal attention model;local gait features;cross-view gait recognition;discriminative feature learning;deep learning;loss function;discriminative spatial-temporal feature extraction;angle center loss;discriminative gait feature learning;LSTM;long short-term memory;convolutional neural networks;CNN;face recognition;Gait recognition;Feature extraction;Three-dimensional displays;Generative adversarial networks;Face recognition;Deep learning;Clothing;Gait recognition;discriminative feature learning;angle center loss;spatial-temporal features},",URL: http://ieeexplore.ieee.org/stamp/stamp.jsp?tp=&arnumber=8759096&isnumber=8835130,122,CNN/LSTM/Attention,,CNN/LSTM/Attention,,"CASIA-B, OULP, OUMVLP",,,2,
"Q. Xu, R. Lin, H. Yue, H. Huang, Y. Yang and Z. Yao, ""Research on Small Target Detection in Driving Scenarios Based on Improved Yolo Network,"" in IEEE Access, vol. 8, pp. 27574-27583, 2020.",doi: 10.1109/ACCESS.2020.2966328,"Abstract: The obtainment of road condition information during driving is extremely important for a driver. However, drivers usually cannot notice multiple information at the same time, which definitely increases certain safety risks. Considering this problem, this paper designs a road information collection plus alarm system based on artificial intelligence to monitor road information. The underlying core algorithm of this system adopts the YOLO v3 network with the best comprehensive detection performance in the end-to-end network. We use this network's advantage of fast detection speed to optimize on its original basis, and propose to “copy” part of the backbone network to build an auxiliary network, which enhances its feature extraction capability. Further, we apply the attention mechanism to the feature information fusion of the auxiliary network and the backbone network, suppress the invalid information channel, and improve the network processing efficiency. Besides, the training part of the network is optimized, and the mAP (mean Average Precision) is improved by setting the scale that meets the target to be detected. Through the test, the average test accuracy of the optimized network model reaches 84.76%, and the real-time detection speed on the 2080Ti reaches 41FPS. Compared with the previous network, the detection accuracy increases by 5.43% after optimization.","keywords: {convolutional neural nets;driver information systems;feature extraction;object detection;optimisation;road safety;target detection;driving scenarios;improved YOLO network;road condition information;safety risks;road information collection;alarm system;artificial intelligence;YOLO v3 network;end-to-end network;fast detection speed;backbone network;feature extraction capability;feature information fusion;information channel;mAP;mean average precision;Feature extraction;Object detection;Roads;Vehicles;Training;Real-time systems;Convolutional neural networks;Convolutional neural network;residual network;target detection;YOLO v3},",URL: http://ieeexplore.ieee.org/stamp/stamp.jsp?tp=&arnumber=8957514&isnumber=8948470,123,YOLO,0.8476,,,Detection in Driving Scenarios,,,2,
