name,doi,Abstract,keywords,URL,key,Algorithm used,Accuracy,base network/provided network,github,application,Dataset,Notes,favourite,Category
"C. Yan et al., ""STAT: Spatial-Temporal Attention Mechanism for Video Captioning,"" in IEEE Transactions on Multimedia, vol. 22, no. 1, pp. 229-241, Jan. 2020.",doi: 10.1109/TMM.2019.2924576,"Abstract: Video captioning refers to automatic generate natural language sentences, which summarize the video contents. Inspired by the visual attention mechanism of human beings, temporal attention mechanism has been widely used in video description to selectively focus on important frames. However, most existing methods based on temporal attention mechanism suffer from the problems of recognition error and detail missing, because temporal attention mechanism cannot further catch significant regions in frames. In order to address above problems, we propose the use of a novel spatial-temporal attention mechanism (STAT) within an encoder-decoder neural network for video captioning. The proposed STAT successfully takes into account both the spatial and temporal structures in a video, so it makes the decoder to automatically select the significant regions in the most relevant temporal segments for word prediction. We evaluate our STAT on two well-known benchmarks: MSVD and MSR-VTT-10K. Experimental results show that our proposed STAT achieves the state-of-the-art performance with several popular evaluation metrics: BLEU-4, METEOR, and CIDEr.","keywords: {computer vision;decoding;encoding;image segmentation;natural language processing;neural nets;video signal processing;video captioning;video summarization;visual attention mechanism;video description;spatial-temporal attention mechanism;spatial structures;temporal structures;encoder-decoder neural network;Feature extraction;Decoding;Semantics;Convolutional neural networks;Visualization;Fuses;Video captioning;spatial-temporal attention mechanism;encoder-decoder neural networks},",URL: http://ieeexplore.ieee.org/stamp/stamp.jsp?tp=&arnumber=8744407&isnumber=8949825,39,CNN/R-CNN,0.738 CIDEr,STAT,,Video Captioning,MSVD,,,
"L. Zhao et al., ""T-GCN: A Temporal Graph Convolutional Network for Traffic Prediction,"" in IEEE Transactions on Intelligent Transportation Systems, vol. 21, no. 9, pp. 3848-3858, Sept. 2020.",doi: 10.1109/TITS.2019.2935152,"Abstract: Accurate and real-time traffic forecasting plays an important role in the intelligent traffic system and is of great significance for urban traffic planning, traffic management, and traffic control. However, traffic forecasting has always been considered an “open” scientific issue, owing to the constraints of urban road network topological structure and the law of dynamic change with time. To capture the spatial and temporal dependences simultaneously, we propose a novel neural network-based traffic forecasting method, the temporal graph convolutional network (T-GCN) model, which is combined with the graph convolutional network (GCN) and the gated recurrent unit (GRU). Specifically, the GCN is used to learn complex topological structures for capturing spatial dependence and the gated recurrent unit is used to learn dynamic changes of traffic data for capturing temporal dependence. Then, the T-GCN model is employed to traffic forecasting based on the urban road network. Experiments demonstrate that our T-GCN model can obtain the spatio-temporal correlation from traffic data and the predictions outperform state-of-art baselines on real-world traffic datasets. Our tensorflow implementation of the T-GCN is available at https://www.github.com/lehaifeng/T-GCN.","keywords: {convolutional neural nets;data handling;graph theory;intelligent transportation systems;learning (artificial intelligence);road traffic;traffic information systems;traffic data dynamic changes;complex topological structure learning;neural network-based traffic forecasting;spatio-temporal correlation;T-GCN model;spatial dependence;gated recurrent unit;temporal graph convolutional network model;temporal dependences;spatial dependences;urban road network topological structure;traffic control;traffic management;urban traffic planning;intelligent traffic system;real-time traffic forecasting;traffic prediction;Predictive models;Forecasting;Roads;Data models;Task analysis;Logic gates;Kalman filters;Traffic forecasting;temporal graph convolutional network (T-GCN);spatial dependence;temporal dependence},",URL: http://ieeexplore.ieee.org/stamp/stamp.jsp?tp=&arnumber=8809901&isnumber=9179974,40,GRU/GCN,0.72/0.87,T-GCN,https://github.com/lehaifeng/T-GCN,Graph CNN,SZ-TAXI/LOS-LOOP,,,
"M. A. Khan, ""An IoT Framework for Heart Disease Prediction Based on MDCNN Classifier,"" in IEEE Access, vol. 8, pp. 34717-34727, 2020.",doi: 10.1109/ACCESS.2020.2974687,"Abstract: Nowadays, heart disease is the leading cause of death worldwide. Predicting heart disease is a complex task since it requires experience along with advanced knowledge. Internet of Things (IoT) technology has lately been adopted in healthcare systems to collect sensor values for heart disease diagnosis and prediction. Many researchers have focused on the diagnosis of heart disease, yet the accuracy of the diagnosis results is low. To address this issue, an IoT framework is proposed to evaluate heart disease more accurately using a Modified Deep Convolutional Neural Network (MDCNN). The smartwatch and heart monitor device that is attached to the patient monitors the blood pressure and electrocardiogram (ECG). The MDCNN is utilized for classifying the received sensor data into normal and abnormal. The performance of the system is analyzed by comparing the proposed MDCNN with existing deep learning neural networks and logistic regression. The results demonstrate that the proposed MDCNN based heart disease prediction system performs better than other methods. The proposed method shows that for the maximum number of records, the MDCNN achieves an accuracy of 98.2 which is better than existing classifiers.","keywords: {bioelectric potentials;convolutional neural nets;diseases;electrocardiography;health care;Internet of Things;learning (artificial intelligence);medical computing;medical signal processing;patient monitoring;regression analysis;smartwatch;heart monitor device;modified deep convolutional neural network;IoT framework;heart disease diagnosis;blood pressure;electrocardiogram;deep learning neural networks;logistic regression;MDCNN based heart disease prediction system;Heart;Diseases;Biomedical monitoring;Cloud computing;Monitoring;Electrocardiography;AEHO;cuttlefish algorithm;MDCNN;IoT;Cleveland dataset;sensors;wearable device;CAGR;electrocardiogram;LSTM;and CNN},",URL: http://ieeexplore.ieee.org/stamp/stamp.jsp?tp=&arnumber=9000918&isnumber=8948470,41,CNN,98.2,MDCNN,,Heart Disease Prediction,UCI repository dataset,,,
"Z. Ul Abideen et al., ""Uncertainty Assisted Robust Tuberculosis Identification With Bayesian Convolutional Neural Networks,"" in IEEE Access, vol. 8, pp. 22812-22825, 2020.",doi: 10.1109/ACCESS.2020.2970023,"Abstract: Tuberculosis (TB) is an infectious disease that can lead towards death if left untreated. TB detection involves extraction of complex TB manifestation features such as lung cavity, air space consolidation, endobronchial spread, and pleural effusions from chest x-rays (CXRs). Deep learning based approach named convolutional neural network (CNN) has the ability to learn complex features from CXR images. The main problem is that CNN does not consider uncertainty to classify CXRs using softmax layer. It lacks in presenting the true probability of CXRs by differentiating confusing cases during TB detection. This paper presents the solution for TB identification by using Bayesian-based convolutional neural network (B-CNN). It deals with the uncertain cases that have low discernibility among the TB and non-TB manifested CXRs. The proposed TB identification methodology based on B-CNN is evaluated on two TB benchmark datasets, i.e., Montgomery and Shenzhen. For training and testing of proposed scheme we have utilized Google Colab platform which provides NVidia Tesla K80 with 12 GB of VRAM, single core of 2.3 GHz Xeon Processor, 12 GB RAM and 320 GB of disk. B-CNN achieves 96.42% and 86.46% accuracy on both dataset, respectively as compared to the state-of-the-art machine learning and CNN approaches. Moreover, B-CNN validates its results by filtering the CXRs as confusion cases where the variance of B-CNN predicted outputs is more than a certain threshold. Results prove the supremacy of B-CNN for the identification of TB and non-TB sample CXRs as compared to counterparts in terms of accuracy, variance in the predicted probabilities and model uncertainty.","keywords: {convolutional neural nets;diagnostic radiography;diseases;feature extraction;image classification;learning (artificial intelligence);lung;medical image processing;B-CNN;machine learning;CNN approaches;uncertainty assisted robust tuberculosis identification;Bayesian convolutional neural networks;infectious disease;TB detection;air space consolidation;deep learning based approach;Bayesian-based convolutional neural network;nonTB manifested CXRs;TB identification methodology;TB benchmark datasets;TB manifestation features;Montgomery dataset;Shenzhen dataset;memory size 12.0 GByte;frequency 2.3 GHz;memory size 320.0 GByte;Feature extraction;Uncertainty;Deep learning;Support vector machines;Bayes methods;Convolutional neural networks;Tuberculosis identification;computer-aided diagnostics;medical image analysis;Bayesian convolutional neural networks;model uncertainty},",URL: http://ieeexplore.ieee.org/stamp/stamp.jsp?tp=&arnumber=8972440&isnumber=8948470,42,CNN,0.9642/0.8646,B-CNN,,Tuberculosis detection,Montgomery/Shenzhen,,,
"S. Seo, C. Kim, H. Kim, K. Mo and P. Kang, ""Comparative Study of Deep Learning-Based Sentiment Classification,"" in IEEE Access, vol. 8, pp. 6861-6875, 2020.",doi: 10.1109/ACCESS.2019.2963426,"Abstract: The purpose of sentiment classification is to determine whether a particular document has a positive or negative nuance. Sentiment classification is extensively used in many business domains to improve products or services by understanding the opinions of customers regarding these products. Deep learning achieves state-of-the-art results in various challenging domains. With the success of deep learning, many studies have proposed deep-learning-based sentiment classification models and achieved better performances compared with conventional machine learning models. However, one practical issue occurring in deep-learning-based sentiment classification is that the best model structure depends on the characteristics of the dataset on which the deep learning model is trained; moreover, it is manually determined based on the domain knowledge of an expert or selected from a grid search of possible candidates. Herein, we present a comparative study of different deep-learning-based sentiment classification model structures to derive meaningful implications for building sentiment classification models. Specifically, eight deep-learning models, three based on convolutional neural networks and five based on recurrent neural networks, with two types of input structures, i.e., word level and character level, are compared for 13 review datasets, and the classification performances are discussed under different perspectives.","keywords: {convolutional neural nets;learning (artificial intelligence);pattern classification;recurrent neural nets;sentiment analysis;deep learning;sentiment classification;customer opinions;grid search;convolutional neural networks;recurrent neural networks;Convolution;Sentiment analysis;Analytical models;Task analysis;Deep learning;Feature extraction;Recurrent neural networks;Sentiment classification;deep learning;convolutional neural network;recurrent neural network;word embedding;character embedding},",URL: http://ieeexplore.ieee.org/stamp/stamp.jsp?tp=&arnumber=8948030&isnumber=8948470,43,LSTM/GRU,,Vanilla RNN/LSTM/CNN/GRU/BRNN,,Sentiment Analysis,,,1,
"T. Su, H. Sun, J. Zhu, S. Wang and Y. Li, ""BAT: Deep Learning Methods on Network Intrusion Detection Using NSL-KDD Dataset,"" in IEEE Access, vol. 8, pp. 29575-29585, 2020.",doi: 10.1109/ACCESS.2020.2972627,"Abstract: Intrusion detection can identify unknown attacks from network traffics and has been an effective means of network security. Nowadays, existing methods for network anomaly detection are usually based on traditional machine learning models, such as KNN, SVM, etc. Although these methods can obtain some outstanding features, they get a relatively low accuracy and rely heavily on manual design of traffic features, which has been obsolete in the age of big data. To solve the problems of low accuracy and feature engineering in intrusion detection, a traffic anomaly detection model BAT is proposed. The BAT model combines BLSTM (Bidirectional Long Short-term memory) and attention mechanism. Attention mechanism is used to screen the network flow vector composed of packet vectors generated by the BLSTM model, which can obtain the key features for network traffic classification. In addition, we adopt multiple convolutional layers to capture the local features of traffic data. As multiple convolutional layers are used to process data samples, we refer BAT model as BAT-MC. The softmax classifier is used for network traffic classification. The proposed end-to-end model does not use any feature engineering skills and can automatically learn the key features of the hierarchy. It can well describe the network traffic behavior and improve the ability of anomaly detection effectively. We test our model on a public benchmark dataset, and the experimental results demonstrate our model has better performance than other comparison methods.","keywords: {computer network security;feature extraction;learning (artificial intelligence);pattern classification;recurrent neural nets;telecommunication traffic;feature engineering;network traffic behavior;BAT-MC;traffic data;convolutional layers;network traffic classification;BLSTM model;network flow vector;attention mechanism;bidirectional long short-term memory;BAT model;traffic anomaly detection model;big data;machine learning models;network anomaly detection;network security;NSL-KDD dataset;network intrusion detection;deep learning methods;Intrusion detection;Feature extraction;Deep learning;Anomaly detection;Machine learning algorithms;Pattern matching;Network traffic;intrusion detection;deep learning;BLSTM;attention mechanism},",URL: http://ieeexplore.ieee.org/stamp/stamp.jsp?tp=&arnumber=8988230&isnumber=8948470,44,LSTM,0.8425,BAT/BLSTM/CNN,,Intrusion Detection,KDDTes/NSL-KDD,,,
"A. Rosenfeld and J. K. Tsotsos, ""Incremental Learning Through Deep Adaptation,"" in IEEE Transactions on Pattern Analysis and Machine Intelligence, vol. 42, no. 3, pp. 651-663, 1 March 2020.",doi: 10.1109/TPAMI.2018.2884462,"Abstract: Given an existing trained neural network, it is often desirable to learn new capabilities without hindering performance of those already learned. Existing approaches either learn sub-optimal solutions, require joint training, or incur a substantial increment in the number of parameters for each added domain, typically as many as the original network. We propose a method called Deep Adaptation Modules (DAM) that constrains newly learned filters to be linear combinations of existing ones. DAMs precisely preserve performance on the original domain, require a fraction (typically 13 percent, dependent on network architecture) of the number of parameters compared to standard fine-tuning procedures and converge in less cycles of training to a comparable or better level of performance. When coupled with standard network quantization techniques, we further reduce the parameter cost to around 3 percent of the original with negligible or no loss in accuracy. The learned architecture can be controlled to switch between various learned representations, enabling a single network to solve a task from multiple different domains. We conduct extensive experiments showing the effectiveness of our method on a range of image classification tasks and explore different aspects of its behavior.","keywords: {learning (artificial intelligence);neural nets;DAM;network architecture;standard fine-tuning procedures;standard network quantization techniques;parameter cost;learned architecture;learned representations;incremental learning;trained neural network;deep adaptation modules;image classification tasks;Task analysis;Switches;Training;Neural networks;Computer architecture;Convolutional codes;Incremental learning;transfer learning;domain adaptation},",URL: http://ieeexplore.ieee.org/stamp/stamp.jsp?tp=&arnumber=8554156&isnumber=8984605,45,CNN,,DAM,,Deep Adaptation/finetuning,,,1,
"S. Jiang, W. Min, L. Liu and Z. Luo, ""Multi-Scale Multi-View Deep Feature Aggregation for Food Recognition,"" in IEEE Transactions on Image Processing, vol. 29, pp. 265-276, 2020.",doi: 10.1109/TIP.2019.2929447,"Abstract: Recently, food recognition has received more and more attention in image processing and computer vision for its great potential applications in human health. Most of the existing methods directly extracted deep visual features via convolutional neural networks (CNNs) for food recognition. Such methods ignore the characteristics of food images and are, thus, hard to achieve optimal recognition performance. In contrast to general object recognition, food images typically do not exhibit distinctive spatial arrangement and common semantic patterns. In this paper, we propose a multi-scale multi-view feature aggregation (MSMVFA) scheme for food recognition. MSMVFA can aggregate high-level semantic features, mid-level attribute features, and deep visual features into a unified representation. These three types of features describe the food image from different granularity. Therefore, the aggregated features can capture the semantics of food images with the greatest probability. For that solution, we utilize additional ingredient knowledge to obtain mid-level attribute representation via ingredient-supervised CNNs. High-level semantic features and deep visual features are extracted from class-supervised CNNs. Considering food images do not exhibit distinctive spatial layout in many cases, MSMVFA fuses multi-scale CNN activations for each type of features to make aggregated features more discriminative and invariable to geometrical deformation. Finally, the aggregated features are more robust, comprehensive, and discriminative via two-level fusion, namely multi-scale fusion for each type of features and multi-view aggregation for different types of features. In addition, MSMVFA is general and different deep networks can be easily applied into this scheme. Extensive experiments and evaluations demonstrate that our method achieves state-of-the-art recognition performance on three popular large-scale food benchmark datasets in Top-1 recognition accuracy. Furthermore, we expect this paper will further the agenda of food recognition in the community of image processing and computer vision.","keywords: {computer vision;convolutional neural nets;feature extraction;image classification;image fusion;image representation;learning (artificial intelligence);object recognition;food image;optimal recognition performance;general object recognition;multiscale multiview feature aggregation scheme;food recognition;high-level semantic features;mid-level attribute features;deep visual features;aggregated features;multiscale fusion;state-of-the-art recognition performance;large-scale food benchmark datasets;image processing;computer vision;multiscale multiview deep feature aggregation;multiscale CNN activations;Feature extraction;Visualization;Image recognition;Semantics;Object recognition;Deep learning;Computer vision;Food recognition;ingredient knowledge;feature aggregation;convolutional neural networks},",URL: http://ieeexplore.ieee.org/stamp/stamp.jsp?tp=&arnumber=8779586&isnumber=8835130,46,,0.983/0.969 top 5,MSMVFA,,Food Recognition,VIREOFOOD-172/CHINESEFOODNET,,1,
"N. Kumar et al., ""A Multi-Organ Nucleus Segmentation Challenge,"" in IEEE Transactions on Medical Imaging, vol. 39, no. 5, pp. 1380-1391, May 2020.",doi: 10.1109/TMI.2019.2947628,"Abstract: Generalized nucleus segmentation techniques can contribute greatly to reducing the time to develop and validate visual biomarkers for new digital pathology datasets. We summarize the results of MoNuSeg 2018 Challenge whose objective was to develop generalizable nuclei segmentation techniques in digital pathology. The challenge was an official satellite event of the MICCAI 2018 conference in which 32 teams with more than 80 participants from geographically diverse institutes participated. Contestants were given a training set with 30 images from seven organs with annotations of 21,623 individual nuclei. A test dataset with 14 images taken from seven organs, including two organs that did not appear in the training set was released without annotations. Entries were evaluated based on average aggregated Jaccard index (AJI) on the test set to prioritize accurate instance segmentation as opposed to mere semantic segmentation. More than half the teams that completed the challenge outperformed a previous baseline. Among the trends observed that contributed to increased accuracy were the use of color normalization as well as heavy data augmentation. Additionally, fully convolutional networks inspired by variants of U-Net, FCN, and Mask-RCNN were popularly used, typically based on ResNet or VGG base architectures. Watershed segmentation on predicted semantic segmentation maps was a popular post-processing strategy. Several of the top techniques compared favorably to an individual human annotator and can be used with confidence for nuclear morphometrics.","keywords: {convolutional neural nets;image segmentation;learning (artificial intelligence);medical image processing;recurrent neural nets;generalized nucleus segmentation techniques;visual biomarkers;digital pathology datasets;MoNuSeg 2018 Challenge;generalizable nuclei segmentation techniques;official satellite event;MICCAI 2018 conference;geographically diverse institutes;training set;test dataset;average aggregated Jaccard index;watershed segmentation;predicted semantic segmentation maps;instance segmentation;multiorgan nucleus segmentation challenge;Image segmentation;Pathology;Image color analysis;Semantics;Machine learning algorithms;Task analysis;Deep learning;Multi-organ;nucleus segmentation;digital pathology;instance segmentation;aggregated Jaccard index},",URL: http://ieeexplore.ieee.org/stamp/stamp.jsp?tp=&arnumber=8880654&isnumber=9084068,47,CNN,,CNN,,,MoNuSeg 2018,,,
"J. Liu et al., ""Feature Boosting Network For 3D Pose Estimation,"" in IEEE Transactions on Pattern Analysis and Machine Intelligence, vol. 42, no. 2, pp. 494-501, 1 Feb. 2020.",doi: 10.1109/TPAMI.2019.2894422,"Abstract: In this paper, a feature boosting network is proposed for estimating 3D hand pose and 3D body pose from a single RGB image. In this method, the features learned by the convolutional layers are boosted with a new long short-term dependence-aware (LSTD) module, which enables the intermediate convolutional feature maps to perceive the graphical long short-term dependency among different hand (or body) parts using the designed Graphical ConvLSTM. Learning a set of features that are reliable and discriminatively representative of the pose of a hand (or body) part is difficult due to the ambiguities, texture and illumination variation, and self-occlusion in the real application of 3D pose estimation. To improve the reliability of the features for representing each body part and enhance the LSTD module, we further introduce a context consistency gate (CCG) in this paper, with which the convolutional feature maps are modulated according to their consistency with the context representations. We evaluate the proposed method on challenging benchmark datasets for 3D hand pose estimation and 3D full body pose estimation. Experimental results show the effectiveness of our method that achieves state-of-the-art performance on both of the tasks.","keywords: {convolutional neural nets;feature extraction;image colour analysis;image enhancement;image representation;pose estimation;short-term dependence-aware module;intermediate convolutional feature maps;3D pose estimation;body part;LSTD module;feature boosting network;RGB image;convolutional layers;Graphical ConvLSTM;Three-dimensional displays;Pose estimation;Two dimensional displays;Boosting;Logic gates;Reliability;Task analysis;3D pose estimation;convolutional LSTM;long short-term dependency;context consistency gate},",URL: http://ieeexplore.ieee.org/stamp/stamp.jsp?tp=&arnumber=8621059&isnumber=8952810,48,CNN/LSTM,0.498/0.877,LSTD/CCG,,3D Pose Estimation,Human3.6M/3DHandPose,,2,
